{
  "schemaVersion": "locale-architecture-how-it-works-v1",
  "locale": "ko",
  "head": {
    "eyebrow": "01 · 작동 방식",
    "title": "텍스트에서 시크릿을 찾아 가립니다.",
    "lede": [
      "이 페이지의 나머지는 그 일을 꼼꼼하게 해내는 방법입니다. 넣은 텍스트는 그대로 나오고, 자격 증명처럼 보이는 부분만 빠집니다. 시크릿이 지나가도 되는 길은 자격 증명 관리자에서 볼트를 거쳐 제공자로 가는 ",
      {
        "b": "한 길뿐"
      },
      "입니다. Redact Secret은 그 밖의 모든 길에 설치하는 필터입니다."
    ]
  },
  "atTheBoundary": {
    "eyebrow": "경계에서 일어나는 일",
    "title": "넣은 텍스트가 그대로 나옵니다",
    "lede": null,
    "ioCaption": "입력과 출력",
    "ioFootnote": [
      {
        "b": "자리표시자는 라벨일 뿐입니다."
      },
      " 어떤 방법으로도 원래 키로 되돌릴 수 없습니다. 원본이 필요하면 ",
      {
        "a": "볼트",
        "to": "architecture/vault"
      },
      "를 쓰세요. 볼트는 별도 저장소에 있고, 일부러 추가해야만 쓸 수 있습니다."
    ]
  },
  "theArchitecture": {
    "eyebrow": "구조",
    "title": "두뇌는 하나, 입은 넷",
    "lede": [
      "어려운 판단은 Rust에서 한 번만 합니다. 각 언어에는 규칙 사본 대신 ",
      {
        "b": "번역기"
      },
      "만 붙습니다."
    ],
    "surfaces": [
      "JS / Node",
      "브라우저",
      "Python",
      "CLI"
    ],
    "claimSub": [
      {
        "code": "detect → resolve → policy → redact"
      }
    ],
    "claim": "Rust 코어",
    "nodeTitle": "안전한 텍스트와 안전한 기록",
    "node": [
      "기록에는 시크릿이 ",
      {
        "em": "어디에"
      },
      " 있었고 ",
      {
        "em": "어떤 종류"
      },
      "였는지만 남습니다. 시크릿 값은 들어가지 않습니다."
    ],
    "stat1": "코어 안의 네트워크 호출, 파일 읽기, 환경 변수 조회, 텔레메트리. 같은 입력이면 항상 같은 결과가 나옵니다.",
    "stat2": "모든 언어가 문자 오프셋까지 똑같이 통과해야 하는 공유 테스트 코퍼스.",
    "stat3": "파이프라인 단계. 탐지 단계는 정책을 정하지 않고, 정책 단계는 탐지하지 않습니다."
  },
  "whatIsInTheBox": {
    "eyebrow": "구성",
    "title": "기능 목록",
    "cards": [
      {
        "title": "두 가지 크기",
        "body": [
          {
            "b": "Full"
          },
          "은 모든 제공자의 형식을 압니다. ",
          {
            "b": "Common"
          },
          "은 브라우저와 작은 에이전트용으로 구조 탐지기 ",
          {
            "var": "structural"
          },
          "개만 남깁니다. 더 작고 빠르며, 오탐도 늘지 않습니다. ",
          {
            "a": "수치는 벤치마크 사이트에",
            "href": "https://benchmarks.redactsecret.dev"
          },
          " 있습니다."
        ]
      },
      {
        "title": "브라우저에서도 실행됩니다",
        "body": "같은 엔진을 WebAssembly로 컴파일하므로, 키가 노트북을 떠나기 전에 잡아낼 수 있습니다. Cloudflare Workers도 지원합니다."
      },
      {
        "title": "CI용 CLI",
        "body": [
          {
            "code": "redact-secret"
          },
          "은 파일이나 스테이징된 diff를 검사합니다. 종료 코드는 ",
          {
            "code": "0"
          },
          " 문제 없음, ",
          {
            "code": "1"
          },
          " 탐지됨, ",
          {
            "code": "2"
          },
          " 오류이고, ",
          {
            "b": "오류가 항상 탐지보다 우선"
          },
          "합니다."
        ]
      },
      {
        "title": "실패하면 막습니다",
        "body": [
          "기본 한도는 입력 ",
          {
            "var": "inputMiB"
          },
          " MiB, 탐지 결과 ",
          {
            "var": "findings"
          },
          "건입니다. 둘 중 하나라도 넘으면 오류를 냅니다. ",
          {
            "b": "결과를 몰래 잘라 내고 깨끗하다고 보고하는"
          },
          " 일은 없습니다."
        ]
      },
      {
        "title": "오류 메시지에는 입력이 담기지 않습니다",
        "body": "모든 오류 메시지는 입력을 포함하지 않는 고정 문구입니다. 방금 잡은 시크릿이 크래시 리포트로 새어 나갈 일이 없습니다."
      },
      {
        "title": "사내 키 형식도 추가할 수 있습니다",
        "body": [
          "사내 자격 증명은 ",
          {
            "b": "룰셋"
          },
          "으로 선언합니다. 룰셋은 콜백이 아니라 코어가 직접 파싱하고 매칭하는 일반 텍스트입니다. 문법은 ",
          {
            "a": "탐지 페이지",
            "to": "architecture/detection"
          },
          "에 있습니다."
        ]
      },
      {
        "title": "실제 로깅·트레이싱 패키지",
        "body": [
          "pino, Python ",
          {
            "code": "logging"
          },
          ", OpenTelemetry span processor는 ",
          {
            "a": "별도 저장소",
            "to": "architecture/adapters"
          },
          "에서 버전이 붙은 어댑터로 배포됩니다."
        ]
      },
      {
        "title": "개인정보 탐지는 선택 사항",
        "body": [
          "이메일, IBAN, 결제 카드, 전화번호, 네트워크 주소, 미국 SSN 계열이 있습니다. ",
          {
            "b": "모든 사용 환경에서 기본값은 꺼짐"
          },
          "입니다."
        ]
      }
    ]
  },
  "theComparison": {
    "eyebrow": "비교",
    "title": "대부분의 시크릿 스캐너는 다른 문을 지킵니다",
    "lede": [
      "Gitleaks, TruffleHog, detect-secrets, GitGuardian은 ",
      {
        "b": "코드"
      },
      "를 보고 개발자가 키를 커밋했는지 확인합니다. Redact Secret은 ",
      {
        "b": "트래픽"
      },
      "을 봅니다. 텍스트가 로그에 남거나, 저장되거나, 모델에 넘어가기 직전에 검사합니다."
    ],
    "nodeTitle1": "코드 → 커밋 → CI",
    "node1": "Gitleaks, TruffleHog, detect-secrets, GitGuardian. 배포 전에 파일과 git 기록을 검사합니다.",
    "nodeTitle2": "실행 중인 앱 → 오가는 텍스트",
    "node2": [
      {
        "b": "Redact Secret."
      },
      " 사용자, 도구, 모델이 지금 주고받는 텍스트를 프로세스 안에서 검사합니다."
    ],
    "p": [
      "둘은 경쟁 관계가 아닙니다. CI에서는 저장소 스캐너를, 요청 경로에서는 Redact Secret을 ",
      {
        "em": "함께"
      },
      " 쓰세요."
    ]
  },
  "beingHonest": {
    "eyebrow": "솔직하게",
    "title": "하지 않는 일",
    "limitsTitle": "다음이 필요하다면 저장소 스캐너를 쓰세요",
    "items": [
      [
        {
          "b": "탐지 범위."
        },
        " Gitleaks의 규칙은 수백 개이고, Redact Secret은 ",
        {
          "var": "families"
        },
        "개 자격 증명 계열입니다. 재현율보다 정밀도를 일부러 택했습니다."
      ],
      [
        {
          "b": "유효성 확인."
        },
        " 제공자에게 키가 살아 있는지 묻지 않으므로, 탐지된 값이 실제 키라고 단정할 수 없습니다."
      ],
      [
        {
          "b": "Git 기록."
        },
        " 커밋 기록을 뒤지지 않고, 저장소를 크롤링하지 않으며, baseline 파일도 쓰지 않습니다."
      ],
      [
        {
          "b": "DLP 플랫폼."
        },
        " 정책 콘솔, 격리 기능, 호스팅 서비스가 없습니다."
      ],
      [
        {
          "b": "검증된 개인정보 탐지."
        },
        " 개인정보 계열은 기본적으로 꺼져 있고 모두 ",
        {
          "status": "Pending",
          "tone": "none"
        },
        " 상태입니다. 쓸 수 있다고 해서 지원한다는 뜻은 아닙니다."
      ]
    ],
    "ruleTitle": "가장 강조하는 규칙",
    "rule": [
      {
        "b": "브라우저 검사는 덤이고, 진짜 경계는 서버 검사입니다."
      },
      " 오래된 클라이언트, 수정된 클라이언트, curl, 에이전트, SDK는 모두 공들인 프런트엔드를 거치지 않습니다. 중요한 곳에서 한 번 더 검사하세요."
    ]
  },
  "sources": {
    "label": "출처.",
    "body": [
      "아키텍처·파이프라인·프로파일·한계는 ",
      {
        "code": "README.md"
      },
      "와 ",
      {
        "code": "ARCHITECTURE.md"
      },
      ", 계열 수와 상태는 자동 생성되는 ",
      {
        "code": "docs/support-matrix.md"
      },
      ", 버전은 ",
      {
        "code": "docs/releases/status.md"
      },
      ". ",
      {
        "var": "observedAt"
      },
      "에 ",
      {
        "code": "main"
      },
      " ",
      {
        "code": [
          {
            "var": "coreCommit"
          }
        ]
      },
      ", ",
      {
        "code": [
          {
            "var": "release"
          }
        ]
      },
      " 기준으로 확인했습니다."
    ]
  }
}
