{
  "schemaVersion": "locale-architecture-how-it-works-v1",
  "locale": "en",
  "head": {
    "eyebrow": "01 · How it works",
    "title": "It finds passwords in text, and crosses them out.",
    "lede": "The rest of this page is about doing that carefully."
  },
  "atTheBoundary": {
    "eyebrow": "At the boundary",
    "title": "Text in, the same text out",
    "lede": [
      "Secrets are allowed on ",
      {
        "b": "one road only"
      },
      ": from your credential manager, through a vault, to the provider. Redact Secret is a filter you install on every other road. Text goes in, the same text comes out, minus anything that looked like a credential."
    ],
    "ioCaption": "Input and output",
    "ioFootnote": [
      {
        "b": "The placeholder is only a label."
      },
      " Nothing turns it back into the key. If you need the original back, use the ",
      {
        "a": "vault",
        "to": "architecture/vault"
      },
      ", which lives in a separate repository and has to be added on purpose."
    ]
  },
  "theArchitecture": {
    "eyebrow": "The architecture",
    "title": "One brain, four mouths",
    "lede": [
      "The hard thinking happens once, in Rust. Every language gets a ",
      {
        "b": "translator"
      },
      ", not its own copy of the rules."
    ],
    "surfaces": [
      "JS / Node",
      "Browser",
      "Python",
      "CLI"
    ],
    "claimSub": [
      {
        "code": "detect → resolve → policy → redact"
      }
    ],
    "claim": "The Rust core",
    "nodeTitle": "Safe text and safe notes",
    "node": [
      "The notes say ",
      {
        "em": "where"
      },
      " a secret was and ",
      {
        "em": "what kind"
      },
      ". They never contain the secret."
    ],
    "stat1": "network calls, file reads, env lookups or telemetry inside the core. Same input, same output, always.",
    "stat2": "shared test corpus every language must pass identically, down to the character offsets.",
    "stat3": "pipeline stages. Detection does not make policy decisions, and policy does not detect."
  },
  "whatIsInTheBox": {
    "eyebrow": "What is in the box",
    "title": "The feature set",
    "cards": [
      {
        "title": "Two sizes",
        "body": [
          {
            "b": "Full"
          },
          " knows every provider. ",
          {
            "b": "Common"
          },
          " keeps only the ",
          {
            "var": "structural"
          },
          " structural detectors, for browsers and small agents: smaller, faster, and it adds no false alarms. ",
          {
            "a": "The measurements are on the benchmarks site.",
            "href": "https://benchmarks.redactsecret.dev"
          }
        ]
      },
      {
        "title": "Runs in the browser",
        "body": "The same engine compiles to WebAssembly, so a key can be caught before it leaves the laptop. Cloudflare Workers is supported."
      },
      {
        "title": "A CLI for CI",
        "body": [
          {
            "code": "redact-secret"
          },
          " checks files or a staged diff. Exit ",
          {
            "code": "0"
          },
          " clean, ",
          {
            "code": "1"
          },
          " found, ",
          {
            "code": "2"
          },
          " broken, and ",
          {
            "b": "broken always outranks found"
          },
          "."
        ]
      },
      {
        "title": "Fails closed",
        "body": [
          {
            "var": "inputMiB"
          },
          " MiB and ",
          {
            "var": "findings"
          },
          " findings by default. Past either, you get an error, never a ",
          {
            "b": "quietly truncated clean result"
          },
          "."
        ]
      },
      {
        "title": "Errors say nothing",
        "body": "Every error message is fixed text with no input in it. Your crash reports cannot leak what your scanner just caught."
      },
      {
        "title": "Bring your own key format",
        "body": [
          "Declare an in-house credential as a ",
          {
            "b": "ruleset"
          },
          ": plain text the core parses and matches itself, never a callback. The grammar is on the ",
          {
            "a": "detection page",
            "to": "architecture/detection"
          },
          "."
        ]
      },
      {
        "title": "Real logging and tracing packages",
        "body": [
          "pino, Python ",
          {
            "code": "logging"
          },
          " and an OpenTelemetry span processor ship as versioned adapters from ",
          {
            "a": "their own repository",
            "to": "architecture/adapters"
          },
          "."
        ]
      },
      {
        "title": "Personal data, opt in",
        "body": [
          "Email, IBAN, payment card, phone, network address and US SSN families. ",
          {
            "b": "Off by default on every surface."
          }
        ]
      }
    ]
  },
  "theComparison": {
    "eyebrow": "The comparison",
    "title": "Most secret scanners guard a different door",
    "lede": [
      "Gitleaks, TruffleHog, detect-secrets and GitGuardian watch ",
      {
        "b": "your code"
      },
      ": did a developer commit a key? Redact Secret watches ",
      {
        "b": "your traffic"
      },
      ", at the moment text is about to be logged, stored, or handed to a model."
    ],
    "nodeTitle1": "Code → commit → CI",
    "node1": "Gitleaks, TruffleHog, detect-secrets, GitGuardian. Scans files and git history, before anything ships.",
    "nodeTitle2": "Running app → text in motion",
    "node2": [
      {
        "b": "Redact Secret."
      },
      " Scans what your users, tools and models are saying, right now, in process."
    ],
    "p": [
      "They are not rivals. Run a repository scanner in CI ",
      {
        "em": "and"
      },
      " this in your request path."
    ]
  },
  "beingHonest": {
    "eyebrow": "Being honest",
    "title": "What it is not",
    "limitsTitle": "Pick a repository scanner instead if you need these",
    "items": [
      [
        {
          "b": "Breadth."
        },
        " ",
        {
          "var": "families"
        },
        " credential families against Gitleaks' several hundred rules. It favors precision over recall on purpose."
      ],
      [
        {
          "b": "Verification."
        },
        " It never asks a provider whether a key is live, so it cannot tell you a match is definitely real."
      ],
      [
        {
          "b": "Git history."
        },
        " No commit archaeology, no repository crawling, no baseline files."
      ],
      [
        {
          "b": "A DLP platform."
        },
        " There is no policy console, no quarantine and no hosted service."
      ],
      [
        {
          "b": "Proven PII."
        },
        " The personal-data families are off by default and every one of them is ",
        {
          "status": "Pending",
          "tone": "none"
        },
        ". Being available does not mean being supported."
      ]
    ],
    "ruleTitle": "The rule it repeats loudest",
    "rule": [
      {
        "b": "Browser scanning is a courtesy; server scanning is the actual boundary."
      },
      " Old clients, modified clients, curl, agents and SDKs all skip your nice front end. Scan again where it counts."
    ]
  },
  "sources": {
    "label": "Sources.",
    "body": [
      "Architecture, pipeline, profiles and limits from ",
      {
        "code": "README.md"
      },
      " and ",
      {
        "code": "ARCHITECTURE.md"
      },
      "; family counts and statuses from the generated ",
      {
        "code": "docs/support-matrix.md"
      },
      "; versions from ",
      {
        "code": "docs/releases/status.md"
      },
      ". Checked on ",
      {
        "var": "observedAt"
      },
      " against ",
      {
        "code": "main"
      },
      " at ",
      {
        "code": [
          {
            "var": "coreCommit"
          }
        ]
      },
      ", ",
      {
        "code": [
          {
            "var": "release"
          }
        ]
      },
      "."
    ]
  }
}
